Q.No,Question,A,B,C,D,Time
1,What Is The Capital Of India,Bangalore,Hyderabad,Kolkata,Delhi,10
2,Which Is The Longest River In India,Ganga,Yamuna,Brahmaputra,None Of These,10
3,In Which Year Did India Get Independence,1945,1939,1919,1947,10
4,Who Was The First Prime Minister Of India,Motilal Nehru,Jawaharlal Nehru,Mahatma Gandhi,Manmohan Singh,10
5,When Is India's Republic Day,26th of January,15th of August,15th of January,26th of August,10
6,What Is The National Song Of India,Jana Gana Mana,Sare Jahan Se Achha,Both A & B,None Of These,10
7,Who wrote Vande Mataram,Bankim Chandra Chatterjee,Poet Iqbal,Rabindranath Tagore,All Of Them,10 